{
  "$comment": "Code generated by tools/ci generate. DO NOT EDIT.\nSource: tools/schemagen (the Go type github.com/brunovenceslau/romeu-e-julieta/internal/cmd/julieta/setup.Report)\n\nGenerated by this command:\n\n\tgo generate ./...\n",
  "$schema": "https://json-schema.org/draft/2020-12/schema",
  "additionalProperties": false,
  "properties": {
    "errors": {
      "items": {
        "type": "string"
      },
      "type": "array"
    },
    "link": {
      "additionalProperties": false,
      "properties": {
        "changed": {
          "type": "boolean"
        },
        "path": {
          "type": "string"
        },
        "target": {
          "type": "string"
        }
      },
      "required": [
        "changed",
        "path",
        "target"
      ],
      "type": "object"
    },
    "repos": {
      "items": {
        "additionalProperties": false,
        "properties": {
          "branchState": {
            "type": "string"
          },
          "cloned": {
            "type": "boolean"
          },
          "defaultBranch": {
            "type": "string"
          },
          "dir": {
            "type": "string"
          },
          "error": {
            "type": "string"
          },
          "fastForward": {
            "type": "string"
          },
          "fetched": {
            "type": "boolean"
          },
          "from": {
            "type": "string"
          },
          "path": {
            "type": "string"
          },
          "to": {
            "type": "string"
          }
        },
        "required": [
          "cloned",
          "defaultBranch",
          "dir",
          "error",
          "fastForward",
          "fetched",
          "from",
          "path",
          "to"
        ],
        "type": "object"
      },
      "type": "array"
    },
    "schema": {
      "const": "julieta-setup/v1",
      "type": "string"
    },
    "unusable": {
      "items": {
        "type": "string"
      },
      "type": "array"
    },
    "version": {
      "type": "string"
    },
    "warnings": {
      "items": {
        "additionalProperties": false,
        "properties": {
          "message": {
            "type": "string"
          },
          "slug": {
            "type": "string"
          }
        },
        "required": [
          "message",
          "slug"
        ],
        "type": "object"
      },
      "type": "array"
    }
  },
  "required": [
    "errors",
    "link",
    "repos",
    "schema",
    "unusable",
    "version",
    "warnings"
  ],
  "title": "julieta-setup.v1",
  "type": "object"
}
