{"errors":[],"link":{"changed":true,"path":"/home/agent/.local/bin/julieta","target":"/romeu/bin/julieta"},"repos":[{"cloned":false,"defaultBranch":"main","dir":"shop-api","error":"","fastForward":"moved","fetched":true,"from":"0123456789abcdef0123456789abcdef01234567","path":"/abs/root/shop-env/shop-api","to":"89abcdef0123456789abcdef0123456789abcdef"}],"schema":"julieta-setup/v1","unusable":[],"version":"v0.1.0","warnings":[{"message":"shop-api 0123456789abcdef0123456789abcdef01234567..89abcdef0123456789abcdef0123456789abcdef","slug":"default-branch-moved"}]}
